question,actual_answer,expected_answer
what was the percentage change in the net cash from operating activities from 2008 to 2009,"The net cash from operating activities increased from $181,001 in 2008 to $206,588 in 2009. This represents a percentage change of approximately 14.16%.",14.1%
what was the percent of the growth in the revenues from 2007 to 2008,"The revenue growth from 2007 to 2008 was calculated as follows: (9362.2 - 9244.9) / 9244.9 * 100, which equals approximately 1.27%.",1.3%
what was the percentage change in net sales from 2000 to 2001?,"The net sales in 2000 were $7983, and in 2001, they were $5363. The percentage change in net sales from 2000 to 2001 is approximately a 32.8% decrease.",-32%
what was the difference in percentage cumulative return on investment for united parcel service inc . compared to the s&p 500 index for the five year period ended 12/31/09?,"For the five-year period ended 12/31/09, United Parcel Service Inc. had a cumulative return of $75.95, while the S&P 500 index had a cumulative return of $102.11. This results in a difference of approximately -25.2% in cumulative return on investment for UPS compared to the S&P 500.",-26.16%
what is the roi of an investment in ups in 2004 and sold in 2006?,"The return on investment (ROI) for an investment in UPS from December 31, 2004, to December 31, 2006, can be calculated based on the stock price change. The investment of $100 would have decreased to $91.06, resulting in a loss of $8.94, or an ROI of -8.94%.",-8.9%
what portion of the total shares subject to outstanding awards is under the 2009 global incentive plan?,"The portion of the total shares subject to outstanding awards under the 2009 global incentive plan is 2,530,454 shares. This is out of a total of 5,923,147 shares subject to outstanding awards across all plans. Therefore, the 2009 global incentive plan accounts for approximately 42.6% of the total outstanding awards.",70.1%
what was the percentage increase in litigation reserves in 2012?,The litigation reserves increased from $3.2 billion in the prior year to $3.7 billion in 2012. This represents a percentage increase of approximately 15.63%.,15.6%
what was the percent of the change in the company 2019s warranty liability from 2011 to 2012,The warranty liability decreased from $107 million in 2011 to $102 million in 2012. This represents a change of approximately -4.67%.,15.7%
what portion of total obligations are due within the next 3 years?,"The total obligations due within the next 3 years amount to $72,890 (which includes $27,729 due in less than 1 year and $45,161 due in 1-3 years). This represents approximately 23% of the total obligations of $317,105.",22.99%
"for the years ended december 31 , 2013 , 2012 and 2011 , what was the total in millions capitalized to assets associated with compensation expense related to long-term compensation plans , restricted stock and stock options?\\n","For the years ended December 31, 2013, 2012, and 2011, the total capitalized to assets associated with compensation expense related to long-term compensation plans, restricted stock, and stock options was approximately $4.5 million, $4.1 million, and $3.4 million, respectively.",12
what was the change in millions between 2014 and 2015 of foreign currency transaction gains ( losses ) for aes corporation?,"The change in foreign currency transaction gains (losses) for AES Corporation between 2014 and 2015 was an increase of $141 million, from a loss of $34 million in 2014 to a gain of $107 million in 2015.",3
what is the percent change in net revenue between 2007 and 2008?,"The net revenue for 2007 was $486.9 million, and for 2008 it was $498.8 million. The percent change in net revenue between 2007 and 2008 is approximately 0.39%.",2.4%
"what portion of the authorized shares of class b common stock is outstanding as of december 31 , 2017?","As of December 31, 2017, there were 707 million shares of Class B common stock outstanding. The authorized shares for Class B common stock are 1.25 billion. Therefore, the outstanding portion of authorized Class B common stock is approximately 56.56%.",56.6%
"as of december 31 , 2011 , what is the total in billions available under the committed credit facilities?","As of December 31, 2011, the total committed but unused credit facilities available was approximately $2.6 billion, which includes $1.4 billion for facilities under construction and $1.2 billion from revolving credit lines.",2.6
what was the 5 year return of the kbw bank index?,"The 5-year return of the KBW Bank Index from the end of 2011 to the end of 2016 was approximately 158.82%, rising from an initial value of 100.00 to 258.82. This reflects the cumulative return over that period.",158.82%
what is the average yearly amortization expense related to trademarks?,"The average yearly amortization expense related to trademarks can be estimated by dividing the total cost of the trademarks by their weighted average useful life of 9 years. However, the specific cost of the trademarks is not provided in the context, so the exact average yearly amortization expense cannot be determined. Therefore, I don't know the answer.",11.1%
in 2014 what was the percent of the change associated with total net charge-offs,"In 2014, the total net charge-offs were $-531 million, a decrease from $-1077 million in 2013. This represents a change of approximately 50.7% associated with total net charge-offs.",14.7%
what is the percentage change in the balance of asset allocation from 2016 to 2017?,"The balance of asset allocation and balanced products increased from $176,675 million in 2016 to $196,545 million in 2017. This represents a percentage change of approximately 11.2%.",11.2%
between 2015 and 2013 what was the average compensation expense related to the issuing of the stock award in millions,"The average compensation expense related to the issuance of stock awards between 2013 and 2015 was $40 million. This is calculated by averaging the expenses of $44 million (2013), $34 million (2014), and $43 million (2015). Thus, the average is ($44 + $34 + $43) / 3 = $40 million.",40.3
"what is the total expected payments for principal of long- term debt , including capital leases in the next 36 months?","The total expected principal payments for long-term debt, including capital leases, over the next 36 months is $1,095,181,000. This amount includes scheduled principal payments for the years 2023, 2024, and 2025. The detailed breakdown for these years is not provided, but the total across the specified period is clear.",594840
what is the percent change in net loss on disposal of assets between 2004 and 2005?,"To calculate the percent change in net loss on disposal of assets from 2004 to 2005, use the formula: \((\text{New Value} - \text{Old Value}) / |\text{Old Value}| \times 100\). The net loss for 2005 was $344,000 and for 2004 was $43,000, resulting in a percent change of \((344,000 - 43,000) / 43,000 \times 100 \approx 696.51\%\). Thus, the percent change in net loss on disposal of assets between 2004 and 2005 is approximately 696.51%.",700%
how much higher are the returns of the s&p 500 in the same period ( 2008-2013 ) ? as a percentage .,"From 2008 to 2013, the S&P 500 index increased from 100 to 228, which is a cumulative return of 128%. In comparison, State Street Corporation's stock increased from 100 to 198, yielding a cumulative return of 98%. Therefore, the returns of the S&P 500 were 30% higher than those of State Street during this period.",30%
what is the percentage change in standardized rwas in 2014?,"The standardized RWAs in December 2014 were $627,444, while in December 2013 they were $635,092. The percentage change in standardized RWAs from December 2013 to December 2014 can be calculated as: \[(\frac{627,444 - 635,092}{635,092}) \times 100\], which results in a decrease of approximately 1.02%.",-1.2%
how much did the annual payments increase from 2019 to 2024 and beyond?,"The annual payments increased from $124,176 in 2019 to $475,000 in 2024 and beyond. This represents an increase of $350,824.",350824 thousand
what was the percentage cumulative total return for edwards lifesciences for the five years ended 2016?,"The cumulative total return for Edwards Lifesciences for the five years ended 2016, assuming an initial investment of $100 at the market close on December 30, 2011, was approximately $265.06. This indicates a significant increase in value over the period.",165%
what percentage did the balance increase from 2007 to 2009?,"The balance increased from $13,750 in November 2008 to $18,161 in October 2009. This represents an increase of approximately 32.5%.",83.6%
what is the percentual decrease observed in the future minimum rental payments during 2008 and 2009?,The future minimum rental payments decreased from $317 million in 2008 to $275 million in 2009. This represents a percentual decrease of approximately 13.25%.,13.25%
what was the percentage change of total debt from 2001 to 2002?,The total debt decreased from $363.9 million in 2001 to $156.7 million in 2002. This represents a percentage change of approximately -57.0%.,-57%
what is the total revenue for the fiscal year of 2015?,"The total revenue for the fiscal year of 2015 is the sum of the quarterly sales and service revenues: $1570 million + $1745 million + $1800 million + $1905 million, which equals $6190 million.",7020
what was the percentage change in revenues for investments in 50% ( 50 % ) or less owned investments accounted for using the equity method between 2000 and 2001?,"The revenues for investments in 50% or less owned investments accounted for using the equity method changed from $6,241 million in 2000 to $6,147 million in 2001. This represents a percentage change of approximately -1.5%.",-2%
how many square feet are owned by the company?,"The company owns approximately 160,000 square feet in Dublin, Ireland, 80,000 square feet in Athlone, Ireland, 70,000 square feet in Bogart, Georgia, and 67,000 square feet in Smithfield, Rhode Island. In total, the owned square footage amounts to 377,000 square feet.",377000
"considering the years 2017 and 2018 , what is the percentual increase observed in capital expenditures used for continuing operations?","The capital expenditures used for continuing operations in 2018 were -240, while in 2017 they were -183. The percentual increase can be calculated as [(−240 - (−183)) / (−183)] * 100, which results in approximately a 31.1% increase.",31.14%
what was the percentage decline in the total restricted cash and marketable securities from 2011 to 2012,The total restricted cash and marketable securities declined from $189.6 million in 2011 to $164.2 million in 2012. This represents a percentage decline of approximately 13.39%.,-13.4%
what was the ratio of the pre-tax impact on equity of hypothetical 10 percent strengthening of the u.s . dollar in 2007 to 2008,"The pre-tax impact on equity of a hypothetical 10 percent strengthening of the U.S. dollar was $150 in 2007 and $84 in 2008. The ratio of the 2007 impact to the 2008 impact is 150:84, which simplifies to approximately 1.79:1.",1.79
what was the percent change in the value of commercial paper outstanding between 2010 and 2011?,"The value of commercial paper outstanding decreased from $2.80 billion at December 31, 2010, to $2.38 billion at December 31, 2011. This represents a percent change of approximately -15.14%.",18%
what was the growth rate of the s&p 500 index from 2011 to 2016,The S&P 500 index grew from 100.0 in 2011 to 198.18 in 2016. This represents a growth rate of approximately 98.18% over the five-year period.,98.2%
"what was the firm's average sum of contractual principal , interest and fees in 2008 and 2009?","The firm's average sum of contractual principal, interest, and fees in 2008 was $118,180 million and in 2009 it was $103,369 million.",$ 110774.5 million
what is the percentage change in staff number in 2013?,"The total staff at the end of 2012 was 32,400, and at the end of 2013, it was 32,900. The percentage change in staff number for 2013 can be calculated as ((32,900 - 32,400) / 32,400) * 100, which is approximately 1.54%.",1.5%
in 2019 what was the net change in cash in millions,"In 2019, the net change in cash was a decrease of $ 2245.8 million. This was calculated from cash and cash equivalents at the end of 2018, which were $ 636.8 million, compared to $ 151.6 million at the end of 2019. The significant cash outflow was primarily due to investing activities.",-489.2
what is the growth rate in the average price of the purchased shares from october to november 2014?,The average price paid per share increased from $176.96 in October 2014 to $187.74 in November 2014. This represents a growth rate of approximately 4.4%.,6.1%
what will be the balance of long-term debt after 1 year assuming that everything is paid as planned and no additional debt is raised?,"The balance of long-term debt after one year, assuming everything is paid as planned and no additional debt is raised, would be $5,389,999. This is calculated by subtracting the current portion of the long-term debt ($619,373) from the total long-term debt ($6,424,582). Therefore, the balance would be $6,424,582 - $619,373 = $5,805,209.",5805209
"in 2018 , what percent of the net cash from operations is retained after financing and investing activities?","The context does not provide specific information on the percentage of net cash from operations retained after financing and investing activities for 2018. Therefore, I don't know the answer.",15.16%
what is the roi of an investment in the o'reilly automotive inc . from 2010 to 2011?,"The ROI of an investment in O'Reilly Automotive Inc. from December 31, 2010, to December 31, 2011, can be calculated as follows: the investment grew from $100 to $132, resulting in a return of $32. Therefore, the ROI is 32%.",32%
what is the percent increase in cash and cash equivalents from year 2009 to 2010?,"The cash and cash equivalents increased from $364,221 in 2009 to $453,257 in 2010. This represents a percent increase of approximately 24.5%.",24.4%
by what percent did effects of foreign operations decrease from 2002 to 2004?,The effects of foreign operations decreased from 5.6 in 2002 to 1.3 in 2004. This represents a decrease of approximately 76.4%.,-76.8%
what was the percentage change of the net revenue in 2010,"The net revenue in 2009 was $4,694 million, and in 2010 it increased to $5,051 million. This represents a percentage change of approximately 7.62%.",7.61%
what was the percentage change in industry segment operating profits from 2006 to 2007?,"The percentage change in industry segment operating profits from 2006 to 2007 was approximately 16.8%. This is calculated from an increase of $349 million, resulting in profits of $2.4 billion in 2007 compared to $2.074 billion in 2006.",17%
what was the percentage increase in the cash and cash equivalents from 2005 to 2006,"The cash and cash equivalents decreased from $125,385 in 2005 to $104,520 in 2006. This represents a percentage decrease of approximately 16.67%, not an increase. Therefore, there was no percentage increase in cash and cash equivalents from 2005 to 2006.",-16.6%
by how much did asset retirement obligations decrease from 2007 to 2008?,"Asset retirement obligations decreased from $1,134 million in 2007 to $965 million in 2008. This represents a decrease of $169 million.",-14.9%
north american printing papers net sales where what percent of total printing paper sales in 2009?,"The retrieved context does not provide the percentage of North American printing papers net sales as part of total printing paper sales in 2009. Therefore, I don't know the answer to the question.",49%
how many of the total global cruise guests are not from north america or europe?,"In 2013, North American cruise guests represented approximately 56% and European cruise guests represented about 30% of global cruise guests. This means that roughly 13.5% of global cruise guests were from regions outside North America and Europe, including the Asia/Pacific region. Therefore, about 13.5% of total global cruise guests are not from North America or Europe.",3085000
by how much did total other income and expense decrease from 2008 to 2009?,"Total other income and expense decreased by $294 million from 2008 to 2009, from $620 million in 2008 to $326 million in 2009.",47.4%
what is the growth rate in the other assets from 2008 to 2009?,"The growth rate in other assets from 2008 to 2009 can be calculated using the values provided: other assets decreased from $216,529,000 in 2008 to $191,265,000 in 2009. This represents a decline of approximately 11.66%. Therefore, the growth rate in other assets for that period is negative, indicating a decrease.",-11.7%
what was the percentage chaning in the total fair value of restricted stock and performance awards vested from 2016 to 2017?,The total fair value of restricted stock and performance awards vested increased from $20.0 million in 2016 to $33.7 million in 2017. This represents a percentage change of approximately 68.5%.,69%
what are the total pre-tax catastrophe losses in the last three years?,"The total pre-tax catastrophe losses for the last three years (2013, 2012, and 2011) are $195.0 million (2013) + $410.0 million (2012) + $1,300.4 million (2011) = $1,905.4 million.",1905.4
what percentage where north american consumer packaging net sales of total consumer packaging sales in 2011?,"The context does not provide specific information regarding the percentage of North American consumer packaging net sales of total consumer packaging sales in 2011. Therefore, I don't know the answer.",67%
what was the percent of the growth in the revenues from 2005 to 2006,"The revenue growth from 2005 to 2006 was calculated as follows: \[(73501 - 50583) / 50583 \times 100 = 45.3\%\]. Therefore, the percent of the growth in revenues from 2005 to 2006 was approximately 45.3%.",45.3%
what percent of the total for 2017 was due to endorsement contracts?,"The total amount for endorsement contracts in 2017 was $919 million. Without the total for 2017 specifically mentioned, I cannot calculate the percentage of the total that this amount represents. Therefore, I don't know the exact percent of the total for 2017 due to endorsement contracts.",58%
what was the percentage change in rental expenses from 2017 to 2018?,"The rental expense for operating leases was approximately $247 million in 2017 and $300 million in 2018. The percentage change in rental expenses from 2017 to 2018 is calculated as ((300 - 247) / 247) * 100, which is approximately 21.5%.",21%
what was the percent of the growth in the recurring tenant improvements from 2006 to 2007,"The percent growth in recurring tenant improvements from 2006 to 2007 can be calculated as follows: \((\frac{45296 - 41895}{41895}) \times 100\), which equals approximately 9.6%.",8.1%
"what was the percentage cumulative total shareholder return on disca common stock from september 18 , 2008 to december 31 , 2012?","The cumulative total shareholder return on Discovery's common stock from September 18, 2008, to December 31, 2012, was $459.67, assuming an initial investment of $100. This indicates a return of approximately 359.67% over that period. The specific percentage cumulative total shareholder return is not provided in the context.",359.67%
what was the percentage change in the net cash used in investing activities from 2006 to 2007,"The net cash used in investing activities decreased from $1,460 million in 2006 to $1,367 million in 2007. This represents a percentage change of approximately 6.36% decrease.",-6.4%
"if the 2003 growth rate is the same as 2002 , what would 2003 gas transmission throughput be in bcf?\\n","If the 2003 growth rate is the same as in 2002, the gas transmission throughput for 2003 would be 597 bcf, the same as in 2002. This is because the context indicates that the throughput for 2002 was 597 bcf. Therefore, assuming no change, the figure remains the same for 2003.",645
what percent of the 2017 end goodwill balance is the goodwill from the acquisition?,"The goodwill from the acquisition in 2017 is $84,159,000. The total end goodwill balance for 2017 is $93,192,000. Therefore, the percent of the end goodwill balance that is from the acquisition is approximately 90.3%.",89.14%
what was the percentage change in revenues between 2005 and 2006?,"The revenue for the year ended January 1, 2006, was $73,501, and for the year ended January 2, 2005, it was $50,583. The percentage change in revenues between 2005 and 2006 is approximately 45.2%.",45%
by how much did total revenues increase from 2010 to 2011?,"Total revenues increased from $11,690 million in 2010 to $14,663 million in 2011. This represents an increase of $2,973 million.",25.4%
what is the percentage change in total dividends paid per share from 2017 to 2018?,"To calculate the percentage change in total dividends paid per share from 2017 to 2018, we use the formula: [(2018 - 2017) / 2017] × 100. The total dividends paid per share were $7.46 in 2017 and $8.20 in 2018, resulting in a percentage change of approximately 9.91%.",9.9%
what is the total number of approved securities by the security holders?,"The total number of approved securities by the security holders is 5,171,000.",12950000
what was the percentage change in the research and development costs from 2015 to 2016,"The research and development costs in 2015 were $119 million, and in 2016 they were $78 million. The percentage change from 2015 to 2016 is a decrease of approximately 34.45%.",-34.4%
what is the percentage change in net reserves from 2011 to 2012?,The net reserves decreased from $480.2 million in 2011 to $425.7 million in 2012. This represents a percentage change of approximately -11.3%.,-11.3%
what is the growth rate in the net income from 2011 to 2012?,"The net income in 2011 was $3,804 million, and in 2012 it was $807 million. This represents a decrease in net income, not a growth. Therefore, the growth rate in net income from 2011 to 2012 is negative.",-78.8%
what is the percentage change in the weight of smokeless products in operating income from 2015 to 2016?,The weight of smokeless products in operating income changed from 12.8% in 2015 to 13.1% in 2016. This represents a percentage change of approximately 2.34%.,2.3%
what percentage of total cable segment capital expenditures in 2004 where due to upgrading of cable systems?,"In 2004, the capital expenditures for upgrading cable systems amounted to $902 million out of a total of $3,622 million. This means that approximately 24.9% of total cable segment capital expenditures were due to upgrading cable systems.",25%
what is the percentage change in the average total short-duration advances from 2013 to 2014?,"The average total short-duration advances in 2013 were $3,749, and in 2014 they were $3,867. The percentage change is calculated as \((\frac{3,867 - 3,749}{3,749}) \times 100\), which equals approximately 3.14%. Therefore, the percentage change in the average total short-duration advances from 2013 to 2014 is about 3.14%.",3.1%
by what percentage did asset retirement obligations increase from 2008 to 2009?,"The asset retirement obligations increased from $965 million in 2008 to $1,102 million in 2009. This represents an increase of approximately 14.2%.",14.2%
"at december 31 , 2010 what was the percent of the total net operating loss carry forwards set to expire between 2021 and 2025","The provided context does not specify the exact percentage of the total net operating loss carryforwards set to expire between 2021 and 2025 as of December 31, 2010. Therefore, I don't know the answer to that question.",64.6%
what percentage of operating income was the emea segment in 2016?,"In 2016, the EMEA segment's operating income was $11.4 million. The total operating income for the company was $417.471 million. Therefore, the EMEA segment represented approximately 2.73% of the total operating income in 2016.",3%
what percent of printing papers sales in 2006 was from north american printing papers net sales?,"The context does not provide specific information about the total printing papers sales in 2006, so I cannot determine what percent of those sales came from North American printing papers net sales.",66%
by how much did american airlines group inc . common stock out preform the s&p 500 index over the 4 year period?,"American Airlines Group Inc. common stock increased from $100 to $175 over the two-year period from December 9, 2013, to December 31, 2015. Meanwhile, the S&P 500 index rose from $100 to $113 during the same period. Therefore, American Airlines outperformed the S&P 500 by approximately 62% over those four years.",48%
what was the percentage change in rental expense for operating leases from 2007 to 2008?,"The rental expense for operating leases was approximately $26.6 million in 2007 and $49.0 million in 2008. The percentage change from 2007 to 2008 can be calculated as ((49.0 - 26.6) / 26.6) * 100, which is approximately 84.5%.",84%
"what is the short-term debt as a percent of long-term debt , in 2019?","To calculate the short-term debt as a percent of long-term debt in 2019, we use the short-term borrowings of $58.2 and the long-term debt of $2907.3. The calculation is ($58.2 / $2907.3) * 100, which results in approximately 2.00%. Therefore, short-term debt as a percent of long-term debt in 2019 is about 2.00%.",1.80%
"how much , in billions , was spent purchasing common stock under the programs from 2016-2018?","From 2016 to 2018, a total of $4.1 billion was spent purchasing common stock under the programs, with $1.3 billion in 2016, $1.3 billion in 2017, and $1.5 billion in 2018.",4.1
