question,actual_answer,expected_answer
what was the percentage increase in the operating profit from 2010 to 2011,"The percentage increase in operating profit from 2010 to 2011 was 7%. In 2010, the operating profit was $973 million, and it increased to $1,069 million in 2011.",9.9%
what is the percent change in net revenue between 2007 and 2008?,"The net revenue in 2007 was $442.3 million, and in 2008 it was $440.9 million. The percent change in net revenue from 2007 to 2008 is approximately a decrease of 0.32%.",0.3%
"what is the average percent of lifo inventories as a percent of consolidated inventories as of december 31 , 2015 and 2014?","As of December 31, 2015, LIFO inventories represented 39% of consolidated inventories, while for 2014, they represented 37%.",38%
what is the percent change in net revenue from 2016 to 2017?,"The net revenue decreased from $1,542 million in 2016 to $1,469 million in 2017. This represents a percent change of approximately -4.73%.",4.97%
"in 2013 , what was the balance in the investment securities portfolio without htm securities , in us$ b?","The balance in the investment securities portfolio without held-to-maturity (HTM) securities at the end of 2013 was $ 323.6 billion. This is derived from the total investment securities portfolio of $ 347.6 billion minus the HTM balance of $ 24.0 billion. Therefore, the balance without HTM securities was $ 347.6 billion - $ 24.0 billion = $ 323.6 billion.",323.6
in 2008 what was the debt to equity ratio,"The debt to equity ratio in 2008 can be calculated using total liabilities and stockholders' equity. Total liabilities were $7,367 million and stockholders' equity was $12,066 million, resulting in a debt to equity ratio of approximately 0.61.",0.59
what was the percentage difference of earnings per share 2013 basic pro forma compared to earnings per share 2013 diluted pro forma in 2004?,"The percentage difference between earnings per share 2013 basic pro forma ($2.25) and earnings per share 2013 diluted pro forma ($2.22) in 2004 is approximately 1.36%. Basic pro forma EPS is higher than diluted pro forma EPS, indicating a slight difference. However, the specific percentage difference for basic versus diluted pro forma EPS is not provided in the context.",1%
what is the percentage change in estimated fair value of the cash flow hedges from 2005 to 2006?,The estimated fair value of cash flow hedges increased from $5.2 million in 2005 to $4.9 million in 2006. This represents a percentage change of approximately -5.77%.,-5.8%
what is the $ 500.0 million in principal paid in 2015 as a percentage of the $ 2.5 billion in outstanding borrowings?,"The $500.0 million paid in principal in 2015 is 20% of the $2.5 billion in outstanding borrowings. This is calculated by dividing $500.0 million by $2.5 billion and multiplying by 100. Thus, the percentage is 20%.",20%
what is the expected growth rate in the rent expense for operating leases in 2016?,"The context does not provide a specific expected growth rate for rent expense for operating leases in 2016. However, the rent expense for operating leases increased from $3.6 million in 2013 to $6.7 million in 2015. Without specific projections or growth rates mentioned, I can't determine the expected growth rate for 2016.",-6.0%
what was the accumulated pre-tax catastrophe losses from 2010 to 2013 in millions,"The accumulated pre-tax catastrophe losses from 2010 to 2013 amounted to $2,476.5 million. This includes $571.1 million in 2010, $1,300.4 million in 2011, $410 million in 2012, and $195 million in 2013.",2476.50
in 2013 what percentage of printing papers sales where attributable to north american printing papers net sales?,"The retrieved context does not provide the total printing papers sales for 2013, so I cannot calculate the percentage attributable to North American printing papers net sales. Therefore, I don't know the answer.",42%
what was the percentage decline in the value of the intangible assets from 2011 to 2012,"The value of intangible assets declined from $218,883 in 2011 to $204,866 in 2012. This represents a percentage decline of approximately 6.4%.",-6.4%
what was the percentage change in the gross unrecognized tax benefits from 2017 to 2018 $ 127.1,The gross unrecognized tax benefits decreased from $148.9 million in 2017 to $127.1 million in 2018. This represents a percentage change of approximately -14%.,-14.6%
what percentage of north america gas comes from us onshore?,"The context does not provide a specific percentage of North America's gas that comes from U.S. onshore sources. However, it states that U.S. onshore gas production is 736 bcf, while North America onshore total gas production is 935 bcf. To calculate the percentage, you would divide 736 by 935, which gives approximately 78.8%.",78.72%
what was the percentage change in operating income from 2005 to 2006?,"The operating income in 2005 was $123,715, and in 2006 it was $302,644. The percentage change in operating income from 2005 to 2006 is approximately 144.4%.",145%
what was the difference between the high and low share price for the period?,"The high share price was $24.41, and the low share price was $12.75. The difference between the high and low share price for the period is $11.66.",11.66
what was the tax rate on the gain on sale of discontinued operations before income taxes,"The tax rate on the gain on sale of discontinued operations before income taxes can be calculated as follows: the income tax expense related to the gain was $1,978,000 on a gain of $14,479,000. This results in a tax rate of approximately 13.7%.",13.7%
what is the percentage change in weighted average common shares outstanding for basic computations from 2015 to 2016?,"The weighted average common shares outstanding for basic computations decreased from 310.3 million in 2015 to 299.3 million in 2016. The percentage change is calculated as [(299.3 - 310.3) / 310.3] * 100, which equals approximately -3.2%. Therefore, there was a decrease of about 3.2% in weighted average common shares outstanding from 2015 to 2016.",-3.5%
what is the net change in cash for the 2014?,"The net change in cash for 2014 can be calculated by considering cash provided by operating activities ($669.5 million), cash used in investing activities ($200.8 million), and cash used in financing activities ($343.9 million). This results in a net change in cash of $124.8 million for 2014.",124.8
what is the percentage change in interest expense from 2015 to 2016?,"The interest expense for 2015 was $14.6 million, and for 2016 it was $26.4 million. The percentage change in interest expense from 2015 to 2016 is approximately 80.82%.",80.8%
what percentage of total minimum lease payments are capital leases?,"Approximately 29% of the total minimum lease payments are capital leases. This is calculated by dividing the total capital lease payments of $1,079 million by the total minimum lease payments of $2,649 million.",29%
what is the percentual contribution of the acquisition of firth rixson in the third-party sales in 2014?,"The retrieved context does not provide specific information on the percentual contribution of the acquisition of Firth Rixson to third-party sales in 2014. It only mentions that third-party sales increased by 4% in 2014, attributed primarily to higher volumes and the acquisition. Therefore, I don't know the exact percentual contribution of the acquisition.",4%
what was the percentage growth of the valero common stock from 2009 to 2011,"To calculate the percentage growth of Valero common stock from 2009 to 2011, we take the stock price at the end of 2009 ($79.77) and the end of 2011 ($102.57). The percentage growth is calculated as ((102.57 - 79.77) / 79.77) * 100, which is approximately 28.6%.",39.54%
what is the roi of an investment in ups in 2004 and sold in 2006?,"The ROI for an investment in UPS from 2004 to 2006 can be calculated by comparing the stock price at the beginning and end of the period. The investment would have started at $100 in 2004 and ended at $91.06 in 2006, resulting in a return of approximately -8.94%. Therefore, the ROI for this investment would be about -8.94%.",-8.9%
"what is the growth rate in net revenue in 2015 for entergy mississippi , inc.?","The net revenue for Entergy Mississippi, Inc. in 2015 was $696.3 million. In comparison, the net revenue for 2014 was $701.2 million. Therefore, the growth rate in net revenue for 2015 was a decline of approximately 0.13%.",-0.7%
what is the percentage change in interest expense from 2015 to 2016?,"The interest expense for 2015 was $14.6 million, and for 2016 it was $26.4 million. The percentage change in interest expense from 2015 to 2016 is approximately 80.82%.",80.8%
what was the total pre-tax restructuring program cost in millions?,"The total pre-tax restructuring program cost recorded was $191 million in 2016 and $83 million in the second quarter of 2018. Additionally, there were $60 million in settlement charges during 2017. The total pre-tax restructuring program cost amounts to $334 million.",257
what was the percentage change in the reclassification of non-controlling interests from 2007 to 2008,The reclassification of non-controlling interests increased from $40 million in 2007 to $105 million in 2008. This represents a percentage change of 162.5% from 2007 to 2008.,162.5%
what is the net increase in the balance of allowance for doubtful accounts receivable during 2015?,"The net increase in the allowance for doubtful accounts receivable during 2015 is calculated as follows: the ending balance at January 2, 2016, is $16,152, and the beginning balance for 2015 is $13,295. Therefore, the net increase is $16,152 - $13,295 = $2,857.",2857
"what is the total value of stock options for leo p . denault , in millions?","The total value of stock options for Leo P. Denault is 50,000.",5.4
what was the percentage change in total proved undeveloped reserves for u.s . onshore from 2010 to 2011?,The total proved undeveloped reserves for U.S. onshore decreased from 411 million barrels of oil equivalent (mmboe) in 2010 to 403 mmboe in 2011. This represents a percentage change of approximately -1.95%.,-2%
what the total number of votes to issue shares of republic common stock and other securities convertible,"The total number of votes to issue shares of Republic common stock and other securities convertible into or exercisable for shares of Republic common stock was 141,728,743 in favor, with 297,976 against and 156,165 abstentions.",142182884
what portion of the securities approved by security holders is to be issued upon exercise of outstanding options and rights?,"The portion of the securities approved by security holders to be issued upon exercise of outstanding options and rights is 17,176,475 shares. There are no outstanding options as of December 31, 2018. Additionally, there are 68,211,649 securities available for future issuance under equity compensation plans approved by security holders.",20.1%
"what percentage of total brokerage payables at december 31 , 2017 where receivables from customers?","As of December 31, 2017, receivables from customers amounted to $19,215, and total brokerage payables were $61,342. To find the percentage, divide the receivables from customers by the total payables: ($19,215 / $61,342) * 100, which equals approximately 31.3%. Therefore, about 31.3% of total brokerage payables at that date were receivables from customers.",31%
what was the percentage of the real estate portfolios for asia from 2014 to 2015,"The percentage of the real estate portfolios for Asia increased from 1,560 in 2014 to 2,330 in 2015. This represents an increase of approximately 49% year-over-year.",49.35%
"what was the cumulative percentage return for the five years ended september 30 , 2011 for apple inc.?","The cumulative percentage return for Apple Inc. over the five years ended September 30, 2011, was 395%. This is calculated based on the increase from $100 invested on September 30, 2006, to $495 by September 30, 2011.",395%
what is the net change in the balance of unrecognized tax benefits from 2007 to 2008?,"The net change in the balance of unrecognized tax benefits from 2007 to 2008 is a decrease of $47,000. The balance at June 1, 2007, was $3.76 million, and it decreased to $3.713 million by May 31, 2008. This reflects the net impact of additions and reductions during that period.",-47
what is the growth rate in brent oil prices from 2016 to 2017?,The growth rate in Brent oil prices from 2016 to 2017 can be calculated as follows: the price in 2016 was $43.64 and in 2017 it was $54.12. This represents an increase of approximately 24% over the year.,24.0%
what was the percentage difference between earnings per share 2013 diluted as reported and earnings per share 2013 diluted pro forma ?,The percentage difference between earnings per share 2013 diluted as reported ($3.85) and earnings per share 2013 diluted pro forma ($3.71) is approximately 3.64%.,-4%
"if the tax controversy from softer is resolved favorably , what would the gross assets acquired be , in millions?","If the tax controversy from Softer is resolved favorably, the gross assets acquired would be $408 million. This total represents the fair value of assets acquired before accounting for any liabilities.",385
what was the percentage change in rental expense for operating leases from 2010 to 2011?,The rental expense for operating leases was $233 million in 2010 and $249 million in 2011. The percentage change from 2010 to 2011 is approximately 6.87%.,7%
what is the roi of global payments from 2004 to 2005?,"The return on investment (ROI) for Global Payments from May 31, 2004, to May 31, 2005, increased from $137.75 to $205.20. This indicates a growth of approximately 49% over that one-year period.",49.0%
what is the percent change in net revenue between 2007 and 2008?,"The net revenue in 2007 was $1,110.6 million, and in 2008 it was $1,117.9 million. The percent change in net revenue between 2007 and 2008 is approximately 0.3%.",0.7%
what portion of the final purchase price of biolucent is dedicated to goodwill?,"The portion of the final purchase price of Biolucent dedicated to goodwill is $47,800. This amount is part of the total aggregate purchase price of approximately $73,200.",65.3%
what will be the percentage increase in rent expense from 2013 to 2014?,"The rent expense for 2014 is $100 million, while it was $94 million in 2013. The percentage increase in rent expense from 2013 to 2014 is approximately 6.38%.",6.4%
by what percentage did the average price per barrel of wcs increase from 2010 to 2012?,The average price per barrel of WCS increased from $65.31 in 2010 to $73.18 in 2012. This represents an increase of approximately 12.1%.,12.1%
what percentage of printing paper sales is attributable to uncoated papers sales in 2005?,"In 2005, uncoated paper sales totaled $4.8 billion, while coated paper sales were $1.6 billion. The total sales for both types of paper would be $4.8 billion + $1.6 billion = $6.4 billion. Therefore, uncoated paper sales represented approximately 75% of total printing paper sales in 2005.",61%
what was amount of shares issued to directors during the period?,"During the period, a total of 8,800 shares were granted to directors (4,800 in 2013 and 4,000 in subsequent entries).",11800
what was the percentage change in rent expense under operating leases from 2010 to 2011?,"The rent expense under operating leases was $271 million in 2010 and $338 million in 2011. The percentage change from 2010 to 2011 can be calculated as (($338 million - $271 million) / $271 million) * 100, which equals approximately 24.7%.",25%
what was the percentage change in research and development net from 2015 to 2016?,The research and development net decreased from $476 million in 2015 to $466 million in 2016. This represents a percentage change of approximately -2.1%.,-2%
what is the increase observed in the weighted average grant date fair value of the restricted stocks in 2006 and 2007?,The weighted average grant date fair value of the restricted stock awards increased from $54.36 in 2006 to $63.59 in 2007. This represents an increase of $9.23.,16.97%
"what is the total fair value impact for all instruments as of may 27 , 2018?","The total fair value impact for all instruments as of May 27, 2018, is $58.4 million, which is the sum of the impacts from interest rate instruments ($33.2 million), foreign currency instruments ($21.3 million), commodity instruments ($1.9 million), and equity instruments ($2.0 million).",58.4
"what was the average balance of total pci consumer loans for the years ended december 31 , 2010 and 2009?","The average balance of total PCI consumer loans for the year ended December 31, 2010, was $19,097, and for 2009, it was $25,544.",22321
what is the percentage change in the fair value per share between 2011 and 2012?,The fair value per share in 2011 was $22.78 and in 2012 it was $23.93. The percentage change from 2011 to 2012 is approximately 5.04%.,5%
"what was the percentage cumulative total shareholder return on pmi's common stock for the five years ended december 31 , 2015?","The cumulative total shareholder return on PMI's common stock for the five years ended December 31, 2015, was $186.20, which represents an increase from the initial investment of $100 as of December 31, 2010. This reflects a percentage increase of 86.20% over the five-year period. Unfortunately, the exact percentage cumulative total shareholder return is not explicitly stated in the provided context.",86.20%
what is the percentage increase in interest expanse and penalties in 2009?,The interest expense and penalties increased from $1.3 million in 2008 to $1.7 million in 2009. This represents a percentage increase of approximately 30.77%.,30.8%
what was the percent of the anticipated increased in the berths capacity to service european cruise market between 2012 and 2016,"The anticipated increase in berths capacity to service the European cruise market between 2012 and 2016 is estimated at approximately 34,000 berths. This represents an increase from about 155,000 berths in 2011 to 189,000 berths by 2016. Thus, the percent increase is roughly 22%.",18.1%
what is the growth rate in net revenue from 2009 to 2010?,The net revenue increased from $485.1 million in 2009 to $540.2 million in 2010. This represents a growth rate of approximately 11.3%.,11.4%
"what is the total value of granted options in 2006 , in millions?","The total value of granted options in 2006 is calculated by multiplying the number of options granted (2,621,050) by the weighted-average exercise price ($27.24), which equals approximately $71.4 million. Additionally, another 3,784,508 options were granted through a business combination at a price of $40.64, totaling about $153.5 million. Therefore, the total value of granted options in 2006 is approximately $224.9 million.",71.4
what was the 5 year return on ventas common stock?,"The 5-year return on Ventas common stock from December 31, 2002, to December 31, 2007, increased from $100 to $512, representing a total return of 412%. This return includes dividends and assumes reinvestment.",412%
"if stock compensation were not an expense , what would 2015 net income have been?","If stock compensation were not an expense, the 2015 net income would have been $403.1 million plus $31.2 million, totaling $434.3 million. This adjustment reflects the exclusion of non-cash equity-based compensation from the net income calculation. Therefore, the 2015 adjusted net income would be $434.3 million.",434300000
what percent of total payments are due within the next year ( 2020 ) ?,"The total payments due in fiscal 2020 are $13,106.9 million, and the payments due within the next year (2020) are $2,378.5 million. To find the percentage, divide the payments due within the next year by the total payments and multiply by 100. This results in approximately 18.14% of total payments due within the next year.",18.15%
what is the percent change in debt to capital from 2012 to 2013?,"The percent change in debt to capital from 2012 to 2013 is calculated as follows: (57.9% - 58.7%) / 58.7% * 100 = -1.36%. Therefore, there is a decrease of approximately 1.36% in the debt to capital ratio from 2012 to 2013.",1.38%
"what is the total impairment charge recorded in the lat three years , in millions?","The total impairment charges recorded in the last three years (2006, 2005, and 2004) are approximately $9.4 million in 2006, $0.6 million in 2005, and $0.2 million in 2004. This sums up to a total of about $10.2 million.",10.2
what is the percent of the principal payments scheduled after 2011 to the total amount,"The total principal payments scheduled after 2011 amount to $1,590 million. The total principal payments scheduled, including all years, is $3,498 million. Therefore, the percent of the principal payments scheduled after 2011 to the total amount is approximately 45.5%.",45.5%
what was the percentage change in cash flows used in investing activities from 2016 to 2017?,"The cash flows used in investing activities decreased from $1,691.5 million in 2016 to $510.8 million in 2017. This represents a percentage change of approximately -69.8%.",-70%
what is the growth rate in the price of espp shares purchased from 2006 to 2007?,The price of ESPP shares purchased increased from a weighted average of $24.98 in 2006 to $33.93 in 2007. This represents a growth rate of approximately 36%.,33.9%
what was the percent of the increase in other income other income for the utility from 2005 to 2006,"The percent increase in other income for the utility from 2005 to 2006 was approximately 40.5%, rising from $111 million to $156 million. This increase was primarily due to carrying charges recorded on storm restoration costs.",40.5%
what portion of the total minimum lease payments is related to interest?,"The portion of the total minimum lease payments that is related to interest is $54,857,000.",15.7%
what is the difference in percentage return between expeditors international of washington inc . and the nasdaq transportation for the five years ended 12/17?,"As of 12/17, Expeditors International of Washington Inc. had a cumulative total return of $176.08, while the Nasdaq Transportation Index had a cumulative total return of $248.92. This results in a difference of approximately 40.8% in favor of the Nasdaq Transportation Index. Therefore, the percentage return difference between the two is significant, with the Nasdaq Transportation Index outperforming Expeditors.",-72.84%
what is the growth rate in net sales for mfc in 2012?,"The growth rate in net sales for MFC in 2012 compared to 2011 was negligible, as net sales for 2012 were comparable to 2011, with figures of $7,457 million and $7,463 million respectively. Therefore, there was no significant growth rate observed.",-0.1%
"what was the difference in percentage cumulative total shareholder return on pmi's common stock versus the s&p 500 index for the five years ended december 31 , 2015?","The cumulative total shareholder return on PMI's common stock for the five years ended December 31, 2015, was $186.20, while the S&P 500 index was $180.80. This indicates that PMI's return was approximately 3.78% higher than the S&P 500 index over that period.",5.40%
"considering the years 2012 and 2013 , what is the increase observed in the service cost?",The service cost for pension benefits increased from $555 in 2012 to $682 in 2013. This represents an increase of $127.,22.88%
what was the percentage growth in the cash dividends from 2010 to 2011,The cash dividends grew from $71 million in 2010 to $78 million in 2011. This represents a percentage growth of approximately 9.86%.,9.9%
what is the percentage change in the balance of common shareholders 2019 equity in 2014?,"The balance of common shareholders' equity as of December 2014 was $73,597 million, compared to $71,267 million as of December 2013. The percentage change from 2013 to 2014 is approximately 3.25%. Therefore, I do not have the specific percentage change for 2019 equity in 2014.",3.3%
"what was the percentage cumulative total shareholder return on pmi's common stock for the five years ended december 31 , 2017?","The cumulative total shareholder return on PMI's common stock for the five years ended December 31, 2017, was $156.80, assuming an initial investment of $100 as of December 31, 2012. This represents a percentage increase of 56.8% over the five-year period.",56.80%
"what is the total fair value impact of all instruments as of may 28 , 2006?","The total fair value impact of all instruments as of May 28, 2006, is $13 million, which includes $8 million from interest rate instruments, $2 million from foreign currency instruments, $2 million from commodity instruments, and $1 million from equity instruments.",13
what was the percentage change in earnings per share from 2005 to 2006?,The earnings per share (EPS) increased from $3.49 in 2005 to $4.27 in 2006. This represents a percentage change of approximately 22.4%.,22%
what was the percentage increase of capital expenditures for operations in the industrial packaging business segment in from 2017 to 2018?,The percentage increase of capital expenditures for operations in the industrial packaging business segment from 2017 to 2018 was approximately 27%. This is calculated from the capital expenditures of $1061 million in 2018 compared to $836 million in 2017.,27%
what was the total impairment relating to us assets?,"The total impairment relating to U.S. assets was $321 million, which includes $120 million from Wolf Hollow and $201 million from Granite Ridge.",321000000
