question,actual_answer,expected_answer
what was the percentage change in the accretable yield activity for the firm 2019s pci consumer loans in 2010,"The accretable yield activity for the firm's PCI consumer loans decreased from $25,544 in 2009 to $19,097 in 2010. This represents a percentage change of approximately -25.2%. The decrease in the accretable yield percentage was primarily due to lower interest rates on variable-rate loans and extended loan liquidation periods.",-25.2
what was the percentage change in net cash from operating activities from 2010 to 2011?,"The net cash from operating activities in 2010 was $3,835 million, and in 2011 it was $7,073 million. The percentage change from 2010 to 2011 is approximately 84.4%.",84%
by how much did the allowance for doubtful accounts increase from 2005 to 2006?,"The allowance for doubtful accounts increased from $46 million in 2005 to $52 million in 2006. Therefore, the increase was $6 million.",13.0%
what was the annual average number of liquid securities and other cash considerations?,"The annual average number of liquid securities and other cash considerations is not explicitly provided in the context. However, as of December 31, 2014, the firm held $19.6 billion in liquid securities and cash collateral, and $14.4 billion in 2013. Therefore, the average for those two years would be approximately $17 billion.",17019.5 million
"between 2012 and 2011 , what was the change in the percentage of crude oil and condensate production that was sour?","The context does not provide specific percentages for sour crude oil and condensate production in 2011 and 2012. Therefore, I cannot determine the change in percentage between those years. Thus, I don't know the answer.",-21
what is the growth rate of the average total short-duration advances from 2012 to 2013?,"The average total short-duration advances increased from $3,365 million in 2012 to $3,749 million in 2013. This represents a growth rate of approximately 11.4%.",11.4%
what is the percentage change in interest expense from 2005 to 2006?,The interest expense in 2005 was $116.4 million and in 2006 it was $134.4 million. The percentage change in interest expense from 2005 to 2006 is approximately 15.8%.,15.5%
"what is the total of the company 2019s future minimum revenues under the terms of all non-cancelable tenant sublease from 2009-2011 , in millions?\\n",The total of the company's future minimum revenues from non-cancelable tenant subleases for the years 2009 to 2011 is $5.6 million + $5.4 million + $4.5 million = $15.5 million.,15.5
what is the rate of return of an investment in ups from 2003 to 2004?,"The rate of return for an investment in United Parcel Service (UPS) from December 31, 2003, to December 31, 2004, can be calculated from the stock prices: it increased from $119.89 to $139.55. This represents a return of approximately 16.49%.",16.4%
how many rooms does loews hotel have outside the us?,"Loews Hotels has two properties outside the U.S.: Loews Le Concorde Hotel in Quebec City, Canada, with 405 rooms, and Loews Hotel Vogue in Montreal, Canada, with 140 rooms. Therefore, they have a total of 545 rooms outside the U.S.",545
what percentage of total future minimum lease payments under the capital lease obligation is due after 2016?,"The total future minimum lease payments under the capital lease obligation due after 2016 amount to $314,269,000. The total minimum lease payments are $705,113,000. Therefore, approximately 44.5% of the total future minimum lease payments are due after 2016.",45%
what is the percentage change in the number of staff in 2012?,"The total staff at period-end in December 2011 was 33,300, and in December 2012 it was 32,400. This represents a percentage change of approximately -2.7%.",-2.7%
what was the average sales inducements deferred from 2009 to 2011 in millions,"The average sales inducements deferred from 2009 to 2011 can be calculated as follows: (59 + 31 + 20) / 3 = 36.67 million. Therefore, the average sales inducements deferred during that period was approximately $36.67 million.",36.7
what is the sum of future debt payments for the next three years?,"The sum of future debt payments for the next three years (fiscal 2009, 2010, and 2011) is approximately $5,976, calculated as $1,977 for 2009, $1,977 for 2010, and $1,422 for 2011.",5931
what is the difference in the range of u.s equities permitted in the company's pension plan?,The company's pension plan permits U.S. equities to range from 15% to 36%. This range is part of the overall asset allocation strategy that includes various other asset classes. The specific allocation can vary based on market conditions and investment strategy changes.,21%
what is the percentual increase observed in the balance between 2004 and 2005?\\n,"The balance increased from $593,706 in 2004 to $728,979 in 2005. This represents a percentual increase of approximately 22.7%.",22.78%
what is the total mw capacity of the boiling water reactors?,"The total capacity of the boiling water reactors listed is 2,131 MW. This includes Pilgrim (688 MW), Fitzpatrick (838 MW), and Vermont Yankee (605 MW).",2131
what percentage of total goodwill in 2012 is allocated to market making?,"In 2012, the total goodwill was $1,934.2 million, and the goodwill allocated to market making was $142.4 million. To find the percentage allocated to market making, divide $142.4 million by $1,934.2 million, which is approximately 7.36%.",7%
what is the total number of sites acquired and constructed during 2015?,"The total number of sites acquired and constructed during 2015 is approximately 25,370.",14970
what was the total fair value building that cytyc had finished constructing in 2008 including the fair market value of the land?,"The total fair value of the building that Cytyc finished constructing in 2008, including the fair market value of the land, is $13,200 (the fair market value of the facility) plus $3,000 (the fair market value of the land), totaling $16,200. Additionally, $4,400 was recorded in fair market value for the building during that year. Therefore, the total fair value would be $16,200.",$ 15100 thousand
what percent did the balance increase from the beginning of 2016 to the end of 2017?,The balance increased from $152 million at the beginning of 2016 to $219 million at the end of 2017. This is an increase of $67 million. To find the percentage increase: (67/152) * 100 = approximately 44.08%.,51.15%
what was the percentage change in building under capital lease from 2016 to 2017?,The buildings under capital lease increased from $190 million in 2016 to $285 million in 2017. This represents a percentage change of approximately 50%.,50%
"based on the review of the restricted stock , restricted stock units , and performance shares activity for 2017 what was the percentage change on the outstanding stock","The outstanding stock decreased from 1,820,578 shares at the end of 2016 to 1,559,231 shares at the end of 2017. This represents a percentage change of approximately -14.37%.",-14.4%
what was the percent of the change in the net revenue from 2016 to 2017,"The net revenue increased from $6,179 million in 2016 to $6,318 million in 2017. This reflects a change of approximately 2.25% in net revenue from 2016 to 2017.",2.3%
what was the percent of the change in the net revenue from 2016 to 2017,"The net revenue increased from $6,179 million in 2016 to $6,318 million in 2017. This represents a change of approximately 2.26%.",2.3%
"what amount of long-term debt is due in the next 36 months for entergy corporation as of december 31 , 2016 , in millions?","The retrieved context does not provide specific information on the amount of long-term debt due in the next 36 months for Entergy Corporation as of December 31, 2016. Therefore, I don't know the answer.",1860.4
what is the growth rate in net revenue in 2007?,"The growth rate in net revenue from 2006 to 2007 is calculated as follows: the net revenue in 2006 was $942.1 million and in 2007 it was $991.1 million. This represents an increase of $49 million, which corresponds to a growth rate of approximately 5.2%.",5.2%
what will be the rate of return for global payments from 2002 to 2003?,"The rate of return for Global Payments from May 31, 2002, to May 31, 2003, is calculated as follows: the value decreased from $100.00 to $94.20. This results in a return of -5.8%.",-5.8%
what was the percent of the change in the non-vested performance awards at end of year,"The non-vested performance awards at the end of the year were 381,000 shares. They began the year at 509,000 shares, resulting in a percent change of approximately -25.1%.",-25%
by what percentage did grant date fair value per share increase from 2013 to 2015?,The grant date fair value per share increased from $40.13 in 2013 to $62.10 in 2015. This represents an increase of approximately 54.7%.,54.7%
"what was the total occupancy and facility costs together with depreciation expense in 2007 , in millions of dollars?","The total occupancy and facility costs together with depreciation expense in 2007 increased by $18 million, or 12%, compared to the previous year. However, the specific total amount for 2007 is not provided in the context. Therefore, I don't know the exact total occupancy and facility costs together with depreciation expense for 2007 in millions of dollars.",150
what is the percent increase in net revenue from 2010 to 2011?,"The net revenue in 2010 was $1,216.7 million, and in 2011 it was $1,252.3 million. The percent increase in net revenue from 2010 to 2011 is approximately 2.9%.",2.93%
what was the percentage change in revenues for investments in 50% ( 50 % ) or less owned investments accounted for using the equity method between 2001 and 2002?,"The revenues for investments in 50% or less owned investments accounted for using the equity method were $6,147 million in 2001 and $2,832 million in 2002. The percentage change in revenues from 2001 to 2002 is a decrease of approximately 54.0%.",-54%
what percent of the total common stock is under the vertex purchase plan?,"The percentage of the total common stock under the Vertex purchase plan is approximately 4.47%. This is calculated by dividing the 842 shares under the plan by the total of 18,851 shares, then multiplying by 100.",4.5%
what was the percent of the gradual decline in the recorded amortization expense from 2006 to 2007,The recorded amortization expense declined from $183.6 million in 2006 to $178.3 million in 2007. This represents a decrease of approximately 1.8%.,2.97%
what percentage decrease occurred from 2011-2012 for deferred acquisition payments?,The deferred acquisition payments decreased from $34.8 million in 2011 to $1.2 million in 2012. This represents a percentage decrease of approximately 96.55%.,96.55%
of the december 2007 property purchase what was the percent of assets allocated to allocated to in-service real estate assets,"In December 2007, $64.1 million was allocated to in-service real estate assets out of a total purchase price. To find the percentage, we need the total purchase price, which is not provided. Therefore, I don't know the percent of assets allocated to in-service real estate assets.",71.5%
what is the growth rate in net income for bermuda subsidiaries from 2008 to 2009?,"The net income for Bermuda subsidiaries in 2008 was $2,196, and in 2009 it was $2,472. The growth rate in net income from 2008 to 2009 can be calculated as approximately 12.6%.",12.6%
what was the 2014 rate of increase in total operating revenues?,"The rate of increase in total operating revenues from 2013 to 2014 was approximately 5.6%, with total operating revenues rising from $21,963 million in 2013 to $23,988 million in 2014.",109%
what percentage of total active full-time equivalent employees consisted of flight attendants?,"Flight attendants constituted approximately 21.9% of the total active full-time equivalent employees. There were 26,000 flight attendants out of a total of 118,500 employees. This percentage is calculated by dividing the number of flight attendants by the total number of employees.",22%
what is the total amount of dollars received from aerospace end market sales in 2015?,"The total amount of dollars received from aerospace end market sales in 2015 is not specified in the provided context. Therefore, I don't know the exact figure.",4006.5
what was the net change in cash in 2016 in millions,"The net change in cash for 2016 was calculated as follows: net cash provided by operating activities ($1,847.8 million) minus net cash used in investing activities ($961.2 million) minus net cash used in financing activities ($851.2 million). This results in a net change of $35.4 million.",35.4
what percent of the net change in revenue between 2007 and 2008 was due to transmission revenue?,"The provided context does not specify the exact percentage of the net change in revenue between 2007 and 2008 that was due to transmission revenue. Therefore, I don't know the answer.",32.7%
what was the difference in percentage cumulative total shareholder return on masco common stock versus the s&p 500 index for the five year period ended 2010?,"The cumulative total shareholder return on Masco common stock was significantly lower than that of the S&P 500 index over the five-year period ending in 2010. However, the exact percentage difference is not provided in the retrieved context. Therefore, I don't know the specific percentage difference.",-60.38%
what was the percentage change in net sales from 2010 to 2011?,"The net sales in 2010 were $65,225 and in 2011 were $108,249. The percentage change in net sales from 2010 to 2011 is approximately 65.9%.",66%
what is the expected percentage change in contributions related to qualified defined benefit pension plans in 2013 compare to 2012?,The expected percentage change in contributions related to qualified defined benefit pension plans in 2013 compared to 2012 is a decrease from $3.6 billion to approximately $1.5 billion. This represents a reduction of about 58.3%.,-58.3%
"what was the percentage change in u.s . pharmaceutical sales return , rebate , and discount liability balances , including managed care , medicare , and medicaid between 2017 and 2018?","The percentage change in U.S. pharmaceutical sales return, rebate, and discount liability balances between 2017 and 2018 can be calculated from the beginning of year balances. The balance increased from $4,172.0 million in 2017 to $4,678.2 million in 2018, which is approximately a 12.1% increase.",12%
"what was the percent of the reduction in the after-tax earnings from joint ventures primarily driven by increased consumer spending at cereal partners worldwide ( cpw ) and unfavorable foreign currency exchange from h e4agen- dazs japan , inc . from 2012 to 2013","The percent reduction in after-tax earnings from joint ventures from fiscal 2013 to fiscal 2014 was approximately 9.1% (from $99 million to $90 million). This decrease was primarily driven by increased consumer spending at Cereal Partners Worldwide (CPW) and unfavorable foreign currency exchange from Häagen-Dazs Japan, Inc.",-9.1%
what is the percentage change in the fair value of the options from 2009 to 2010?,"The weighted average fair value of options granted in 2009 was $7.18, and in 2010, it was $7.84. The percentage change in fair value from 2009 to 2010 is approximately 9.2%.",7.18
what is the percentage change in annual operating cash flow from 2009 to 2010?,"The annual operating cash flow increased from $10,159 million in 2009 to $18,595 million in 2010. This represents a percentage change of approximately 83.5%.",83%
for the quarter ended june 30 what was the percentage change in the share price from he lowest to the highest,"For the quarter ended June 30, the share price changed from a low of $11.13 to a high of $16.00. The percentage change in the share price is approximately 43.5%.",43.8%
what was the percentage change in total operating expenses between 2008 and 2009?,"Total operating expenses in 2008 were $510, and in 2009 they increased to $1420. This represents a percentage change of approximately 178.43%.",178%
how many square feet are leased by the company?,"The company leases approximately 514,000 square feet in New Haven, Connecticut, and 81,000 square feet in Lexington, Massachusetts. The total leased square footage is therefore about 595,000 square feet. Additionally, there may be other leased spaces in the U.S. and foreign countries, but specific details are not provided.",664000
what was the percentage change in industry segment operating profits from 2005 to 2006?,"The industry segment operating profits increased from $1,622 million in 2005 to $2,074 million in 2006. This represents a percentage change of approximately 28% from 2005 to 2006.",28%
what is the growth rate in operating expenses in 2018?,"The growth rate in operating expenses for 2018 was 12% compared to 2017. Operating expenses were $23.46 billion in 2018, up from $20.94 billion in 2017. The increase was driven by higher compensation and benefits expenses and investments for growth.",12.0%
what is the percentage change in net income from 2009 to 2010?,"The net income in 2009 was $124 million, and in 2010 it was $135 million. The percentage change in net income from 2009 to 2010 is approximately 8.06%.",8.9%
what was the total income tax benefit that came from buying back their common stock from 2013 to 2015?,"The total income tax benefit from share-based compensation related to common stock buybacks from 2013 to 2015 amounted to approximately $ -19.6 million, calculated as the sum of the annual tax benefits: -5.6 million (2013), -7.1 million (2014), and -6.9 million (2015).",$ 19.6 million
what was the cumulative change in apple inc . stock between 2016 and 2011?,The cumulative change in Apple Inc. stock between September 2011 and September 2016 was from $100 to $213. This represents a cumulative increase of 113%.,113
"considering the years 2009 and 2010 , what is the difference between the growth of the benefit payments and the expected subsidy receipts?","In 2009, benefit payments were $2,641 and expected subsidy receipts were $77, resulting in net benefit payments of $2,564. In 2010, benefit payments increased to $3,139 and expected subsidy receipts rose to $91, leading to net benefit payments of $3,048. The difference in growth between net benefit payments for 2010 ($3,048 - $2,564 = $484) and the increase in expected subsidy receipts ($91 - $77 = $14) shows that net benefit payments grew by $484 while subsidy receipts grew by $14.",0.67%
"what is the growth rate in net revenue in 2016 for entergy arkansas , inc.?","The net revenue for Entergy Arkansas, Inc. in 2016 was $1,520.5 million, compared to $1,362.2 million in 2015. This represents a growth rate of approximately 11.6% in net revenue for 2016. The increase was influenced by an interim base rate adjustment surcharge.",11.6%
what percent of facilities are owned by the company?,The company owns 196 facilities out of a total of 322 facilities. This means approximately 61% of the facilities are owned by the company.,60.87%
what is the percent change in state street corporation's cumulative total shareholder return on common stock between 2008 and 2009?,The cumulative total shareholder return on State Street Corporation's common stock decreased from $49 in 2008 to $55 in 2009. This represents a percent change of approximately 12.24%.,-11%
what was the percentage difference in natural gas marketed ( bcf ) between 2010 and 2011?,"The marketed natural gas in 2010 was 919 bcf, while in 2011 it was 845 bcf. This represents a percentage decrease of approximately 8.04% from 2010 to 2011.",-8%
what is the statistical interval that interest income can be affected during the next year based on the data from 2013?,"Based on the data from 2013, a 100-basis-point increase or decrease in interest rates would affect interest income by approximately $16.4, assuming balances remain constant. Therefore, the statistical interval for interest income could vary by $16.4 depending on interest rate fluctuations. The actual interest income in 2013 was $24.7 million.",$ 8.3 < interest income < $ 41.1 . or the interest income would be between $ 8.3 million and $ 41.1 million
what was the difference in percentage return for lilly compared to the s&p 500 for the five years ended dec-18?,"For the five years ended December 2018, Lilly had a cumulative return of $259.88, while the S&P 500's return was $150.33. This results in a difference of approximately 73% in favor of Lilly compared to the S&P 500. Therefore, Lilly outperformed the S&P 500 by about 73% over that period.",
"based solely on cash for towers acquisitions , what was the average cost per tower acquired in 2005-2007?","The average cost per tower acquired from 2005 to 2007 can be calculated by summing the total cash spent on acquisitions and dividing by the total number of towers acquired. The total cash spent was approximately $44.0 million + $14.3 million + $6.0 million = $64.3 million, and the total number of towers acquired was 293 + 84 + 30 = 407 towers. Therefore, the average cost per tower acquired during that period was approximately $158,000.",200000
in 2014 what was the percent of shares withheld from employees to cover their statutory minimum withholding requirements for personal income taxes to the shares purchased,"The retrieved context does not provide specific information about the percent of shares withheld from employees in 2014 to cover their statutory minimum withholding requirements for personal income taxes. Therefore, I don't know the answer.",
what was the percentage change in warranty reserve from 2005 to 2006?,"The warranty reserve decreased from $231,000 in 2006 to $167,000 in 2006. This represents a percentage change of approximately -27.8%.",-28%
what was the percentage cumulative total return for e*trade financial corporation for the five years ended 12/15?,The percentage cumulative total return for e*trade financial corporation for the five years ended 12/15 was 185.25%.,85.25%
"between 2000 and 2001 , what was the percent increase of unrealized gains?",The unrealized gain on available-for-sale securities increased from $19 in 2000 to $96 in 2001. This represents a percent increase of approximately 405.26%.,405.3%
in 2013 what was the percentage change in the nonvested rsus,"The nonvested RSUs decreased from 4,822,000 at December 31, 2012, to 3,859,000 at December 31, 2013. This represents a percentage change of approximately -19.9%.",-20%
"in december 2011 , what was the total dollar value of the vornado common shares rceived as payment for the exercise of certain employee options?","In December 2011, the total dollar value of the Vornado common shares received as payment for the exercise of certain employee options was $31,320,147. This was calculated using 410,783 shares at an average price of $76.36 per share.",31367389
what is the percentage of additional collateral or termination payments for a two-notch downgrade over additional collateral or termination payments for a one-notch downgrade for 2012?,"In 2012, additional collateral or termination payments for a one-notch downgrade were $1,534 million, while for a two-notch downgrade they were $2,500 million. The difference between them is $966 million. Therefore, the percentage increase from a one-notch to a two-notch downgrade is approximately 63% ($966 million increase from $1,534 million).",63%
in 2008 what was the percentage increased in the mezzanine capital facility,"In 2008, the mezzanine capital facility increased from $3.5 billion to $4.5 billion, representing a percentage increase of approximately 28.57%.",28.6%
what is the 6 year total shareholder return on apple . inc.?,"The 6-year total shareholder return for Apple Inc. from September 30, 2008, to September 30, 2013, is reported as $431, meaning an investment of $100 grew to $431. In comparison, the S&P 500 index grew to $161 during the same period. This indicates that Apple significantly outperformed the S&P 500 index over these six years.",331%
what percentage of industrial packaging sales where represented by north american industrial packaging net sales in 2013?,"The context does not provide specific information about the percentage of industrial packaging sales represented by North American industrial packaging net sales in 2013. Therefore, I don't know the answer.",84%
in 2016 what was the ratio of the five-year cumulative total return for citi compared to s&p 500,"As of December 31, 2016, Citi's five-year cumulative total return was 229.3, while the S&P 500's was 198.2. This indicates that Citi outperformed the S&P 500 during that five-year period. The ratio of Citi's return compared to the S&P 500 is approximately 1.15.",1.32
what was the percentage change in free cash flow from 2008 to 2009?,"The free cash flow in 2008 was $825 million, while in 2009 it was $515 million. This represents a percentage change of approximately -37.6% from 2008 to 2009.",-38%
what is the growth rate in research and development expenses from 2013 to 2014?,The research and development expenses increased from $85 million in 2013 to $86 million in 2014. This represents a growth rate of approximately 1.18%.,1.2%
what percentage of mw from acquired or commenced commercial operations in 2010 were due to ballylumford in the united kingdom?,"Ballylumford in the United Kingdom accounted for 1,246 MW out of a total of 2,404 MW acquired or commenced commercial operations in 2010. This means that Ballylumford contributed approximately 51.8% of the total MW.",52%
