question,actual_answer,expected_answer,score,explanation
what was the percentage change in the net cash from operating activities from 2008 to 2009,"The net cash from operating activities increased from $181,001 in 2008 to $206,588 in 2009. This represents a percentage change of approximately 14.2%.",14.1%,0.5,"The student's answer of 14.1% is close to the ground truth answer of 14.2%, which indicates they have the right idea but are slightly off in their calculation. Since the percentage change is within an acceptable margin of error (±0.5%), the student demonstrated understanding of the concept but made a minor computational error."
what was the percent of the growth in the revenues from 2007 to 2008,"The revenue in 2007 was $9,244.9 million and in 2008 it was $9,362.2 million. The growth in revenue from 2007 to 2008 is approximately 1.27%.",1.3%,1.0,"The student's answer of 1.3% is a rounded value of the growth percentage, which is approximately 1.27% as stated in the ground truth answer. This slight difference in rounding (1.27% rounded to 1.3%) does not conflict with the ground truth answer and thus satisfies the criteria for factual accuracy."
what was the percentage change in net sales from 2000 to 2001?,"The percentage change in net sales from 2000 to 2001 is calculated as follows: ((net sales in 2001 - net sales in 2000) / net sales in 2000) * 100. This results in (($5363 - $7983) / $7983) * 100, which is approximately -32.8%.",-32%,1.0,"The student's answer of -32% is factually accurate relative to the ground truth answer. While the ground truth provides a detailed calculation, the student's answer correctly reflects the resulting percentage change in net sales, rounding it to a whole number. There are no conflicting statements in the student's answer, and it aligns with the calculation provided in the ground truth."
what was the difference in percentage cumulative return on investment for united parcel service inc . compared to the s&p 500 index for the five year period ended 12/31/09?,"The cumulative return on investment for United Parcel Service Inc. was $75.95 at the end of the five-year period, while the S&P 500 index was $102.11. This results in a difference of approximately -26.18% in cumulative return for UPS compared to the S&P 500.",-26.16%,0.5,"The student's answer of -26.16% is very close to the ground truth answer of -26.18%. The difference of 0.02% is within an acceptable margin of ±0.5%, indicating that the student understood the cumulative return percentage difference concept. However, since the student answer is not exactly the same as the ground truth, a score of 0.5 is appropriate."
what is the roi of an investment in ups in 2004 and sold in 2006?,"The ROI of an investment in UPS from December 31, 2004, to December 31, 2006, can be calculated from the stock price data. The investment of $100 was worth $91.06 by the end of 2006, yielding an ROI of approximately -8.94%.",-8.9%,1.0,"The student's answer of -8.9% accurately reflects the ROI of approximately -8.94% as stated in the ground truth answer. The student rounded the value correctly, and there are no conflicting statements present in the answer. Therefore, the student meets all criteria for a full score."
